,Egtmcbr Btihywk,,,"css, javascript, node.js",1.36,BCA,4.0,4.0,4.0,2.0,2.0,egtmcbr.btihywk@gmail.com,,,,3.1,-0.7128981208133885,0,0
,Ylfjw Jajprw,,,"deep learning, java, kubernetes, machine learning, node.js, react",3.62,M.Sc,5.0,1.0,2.0,2.0,2.0,ylfjw.jajprw@gmail.com,,,,2.0500000000000003,0.6690906992011479,1,1
,Dnoyenu Olmsp,,,"html, java, machine learning, pytorch, python, react",2.91,Diploma,5.0,1.0,5.0,4.0,2.0,dnoyenu.olmsp@gmail.com,,,,3.05,0.23492606990454581,1,1
,Lazkzthi Khrfbv,,,"aws, javascript, kubernetes, machine learning, python, tensorflow",7.65,M.Tech,2.0,5.0,1.0,1.0,5.0,lazkzthi.khrfbv@gmail.com,,,,1.6500000000000004,3.1334335950677774,1,1
,Ysmvwfw Sjzyrm,,,"data analysis, pytorch, tensorflow",0.76,B.E,3.0,1.0,3.0,5.0,3.0,ysmvwfw.sjzyrm@gmail.com,,,,2.2,-1.0797978075429115,0,0
,Sktfn Bjsgnchn,,,"aws, c++, data analysis, java, javascript, machine learning, node.js",0.15,B.Tech,1.0,5.0,5.0,3.0,1.0,sktfn.bjsgnchn@gmail.com,,,,3.2,-1.45281248905126,1,1
,Tanyexwh Lvgvtvpc,,,"html, node.js, python",2.19,M.Sc,1.0,1.0,3.0,5.0,2.0,tanyexwh.lvgvtvpc@gmail.com,,,,1.8500000000000003,-0.20535355417088189,1,1
,Zwhdmv Fjcidkgz,,,"c++, javascript, machine learning, node.js, pytorch, python",4.2,B.Tech,3.0,5.0,1.0,5.0,4.0,zwhdmv.fjcidkgz@gmail.com,,,,2.85,1.0237603963730202,1,1
,Lvnmvhty Pojqqjnw,,,"css, data analysis, deep learning, docker, java, react",0.58,M.Tech,4.0,5.0,4.0,4.0,5.0,lvnmvhty.pojqqjnw@gmail.com,,,,3.3499999999999996,-1.1898677135617686,0,0
,Nssgob Cybhfsqg,,,"css, html, pytorch, sql",0.33,M.Tech,2.0,3.0,4.0,4.0,1.0,nssgob.cybhfsqg@gmail.com,,,,2.85,-1.3427425830324031,0,0
,Npnxp Kkxxfwus,,,"aws, css, deep learning, tensorflow",2.32,M.Tech,2.0,1.0,2.0,1.0,4.0,npnxp.kkxxfwus@gmail.com,,,,0.8000000000000002,-0.12585862204615197,0,0
,Yhbgv Aiwtish,,,"css, docker, java, machine learning, node.js",0.91,Diploma,3.0,5.0,2.0,3.0,4.0,yhbgv.aiwtish@gmail.com,,,,2.65,-0.9880728858605308,1,1
,Lcfcmms Mktihbce,,,"data analysis, python, sql",1.61,BCA,1.0,3.0,3.0,4.0,3.0,lcfcmms.mktihbce@gmail.com,,,,2.0999999999999996,-0.560023251342754,0,0
,Jigeddta Kouymrd,,,"html, javascript, python",5.91,B.Sc,5.0,2.0,2.0,1.0,3.0,jigeddta.kouymrd@gmail.com,,,,2.0,2.0694245035521606,1,1
,Griwq Ztjkn,,,"data analysis, pytorch, python, tensorflow",3.6,Diploma,1.0,2.0,4.0,3.0,1.0,griwq.ztjkn@gmail.com,,,,2.1,0.6568607096434972,1,1
,Zlpwb Bnoxfymj,,,"data analysis, java",1.55,B.E,1.0,3.0,1.0,4.0,2.0,zlpwb.bnoxfymj@gmail.com,,,,1.8499999999999999,-0.5967132200157064,0,0
,Zxvcgdpb Lnfkd,,,"data analysis, machine learning",1.49,M.Tech,4.0,3.0,3.0,2.0,1.0,zxvcgdpb.lnfkd@gmail.com,,,,2.75,-0.6334031886886586,1,1
,Iccgfj Tmmxug,,,"docker, html, javascript, machine learning, pytorch",0.87,M.Sc,5.0,5.0,4.0,2.0,5.0,iccgfj.tmmxug@gmail.com,,,,3.1999999999999997,-1.0125328649758323,1,1
,Zwoxjj Mbznlm,,,"deep learning, python",0.38,Diploma,5.0,1.0,1.0,5.0,3.0,zwoxjj.mbznlm@gmail.com,,,,2.3,-1.3121676091382761,0,0
,Hnsyfix Jglvt,,,"aws, c++, html, python",1.73,B.E,3.0,4.0,3.0,4.0,4.0,hnsyfix.jglvt@gmail.com,,,,2.7499999999999996,-0.48664331399684946,1,1
,Jrybyzhq Fwnkq,,,"aws, c++, deep learning, docker, kubernetes, node.js",1.24,Diploma,3.0,4.0,2.0,4.0,1.0,jrybyzhq.fwnkq@gmail.com,,,,3.0000000000000004,-0.7862780581592932,0,0
,Bhenpkr Nhswfehq,,,"aws, css, html, java, machine learning, tensorflow",3.02,M.Tech,3.0,1.0,3.0,1.0,2.0,bhenpkr.nhswfehq@gmail.com,,,,1.55,0.30219101247162494,1,1
,Olclgtcx Iighid,,,"docker, pytorch, sql, tensorflow",2.48,B.E,3.0,1.0,5.0,2.0,4.0,olclgtcx.iighid@gmail.com,,,,1.8499999999999996,-0.028018705584945763,0,0
,Inzod Wmnpvte,,,"aws, css, kubernetes, node.js, pytorch, react",2.71,B.Sc,4.0,1.0,4.0,2.0,3.0,inzod.wmnpvte@gmail.com,,,,2.05,0.11262617432803804,0,0
,Rapxqyc Cyxargyf,,,"css, deep learning, java, pytorch, python, react, sql",0.91,MCA,3.0,3.0,5.0,4.0,3.0,rapxqyc.cyxargyf@gmail.com,,,,3.0,-0.9880728858605308,1,1
,Iqcja Afafcuj,,,"c++, html, machine learning, python",3.42,B.Tech,3.0,2.0,3.0,5.0,4.0,iqcja.afafcuj@gmail.com,,,,2.35,0.5467908036246402,1,1
,Mhuxol Iwahcpa,,,"docker, python, tensorflow",0.76,Diploma,5.0,2.0,1.0,1.0,5.0,mhuxol.iwahcpa@gmail.com,,,,1.5000000000000004,-1.0797978075429115,0,0
,Pppgxr Hxzjkk,,,"c++, machine learning",2.71,BCA,4.0,3.0,3.0,2.0,4.0,pppgxr.hxzjkk@gmail.com,,,,2.3,0.11262617432803804,1,1
,Xcdyqgz Jesljf,,,"docker, machine learning, react, sql, tensorflow",0.16,BCA,4.0,5.0,1.0,5.0,5.0,xcdyqgz.jesljf@gmail.com,,,,2.95,-1.4466974942724344,1,1
,Jclcr Gtzlk,,,"css, java",3.06,B.Tech,1.0,3.0,1.0,5.0,1.0,jclcr.gtzlk@gmail.com,,,,2.1999999999999997,0.3266509915869265,0,0
,Rqtbrxe Hjuppxw,,,"css, machine learning, pytorch, python, react, tensorflow",2.41,Diploma,1.0,5.0,5.0,3.0,1.0,rqtbrxe.hjuppxw@gmail.com,,,,3.2,-0.07082366903672334,1,1
,Gkanwror Vcxmx,,,"aws, c++, javascript, kubernetes, pytorch, python, react",2.88,BCA,1.0,1.0,1.0,2.0,2.0,gkanwror.vcxmx@gmail.com,,,,0.8499999999999999,0.2165810855680695,1,1
,Shsuih Bkdnoroz,,,"deep learning, java, machine learning, node.js, pytorch, tensorflow",2.28,MCA,3.0,4.0,2.0,5.0,4.0,shsuih.bkdnoroz@gmail.com,,,,2.75,-0.15031860116145354,1,1
,Xkpanyd Cbulkjn,,,"data analysis, html, tensorflow",0.64,MCA,4.0,1.0,1.0,1.0,3.0,xkpanyd.cbulkjn@gmail.com,,,,1.25,-1.153177744888816,0,0
,Hfnbbh Muvbojat,,,"machine learning, python",1.69,B.E,2.0,1.0,3.0,4.0,2.0,hfnbbh.muvbojat@gmail.com,,,,1.9000000000000001,-0.5111032931121511,1,1
,Ihhbpjg Bcukc,,,"data analysis, javascript, kubernetes, machine learning, python, tensorflow",3.3,B.Tech,1.0,5.0,1.0,4.0,2.0,ihhbpjg.bcukc@gmail.com,,,,2.45,0.4734108662787355,1,1
,Wzijbwvs Nmxiy,,,"javascript, machine learning, pytorch",0.13,Diploma,4.0,5.0,2.0,2.0,4.0,wzijbwvs.nmxiy@gmail.com,,,,2.6999999999999997,-1.465042478608911,1,1
,Ozahfmca Zfppdwyd,,,"c++, data analysis, javascript, node.js",2.03,B.Sc,3.0,5.0,5.0,2.0,1.0,ozahfmca.zfppdwyd@gmail.com,,,,3.5,-0.3031934706320881,1,1
,Cgfinn Zalgkh,,,"html, javascript, python",1.7,B.E,4.0,3.0,5.0,3.0,3.0,cgfinn.zalgkh@gmail.com,,,,3.05,-0.5049882983333256,1,1
,Flubiyf Ukbbzg,,,"data analysis, kubernetes, machine learning, react, tensorflow",3.58,B.Tech,1.0,5.0,5.0,4.0,2.0,flubiyf.ukbbzg@gmail.com,,,,3.25,0.6446307200858464,1,1
,Kdcsnb Ucqyz,,,"data analysis, html, java, kubernetes, pytorch, python",3.86,Diploma,5.0,5.0,1.0,2.0,2.0,kdcsnb.ucqyz@gmail.com,,,,3.0500000000000003,0.815850573892957,1,1
,Xikkksdo Zeomkauy,,,"data analysis, deep learning, docker, pytorch, python",2.6,BCA,4.0,5.0,3.0,4.0,3.0,xikkksdo.zeomkauy@gmail.com,,,,3.45,0.045361231760958895,1,1
,Gwlwwed Xsemss,,,"css, data analysis, python, sql",2.01,M.Sc,3.0,2.0,3.0,5.0,2.0,gwlwwed.xsemss@gmail.com,,,,2.6500000000000004,-0.3154234601897389,1,1
,Jumwoh Ythxj,,,"data analysis, python",0.49,MCA,3.0,1.0,5.0,5.0,3.0,jumwoh.ythxj@gmail.com,,,,2.5999999999999996,-1.2449026665711969,0,0
,Adbksw Ywzsq,,,"docker, javascript, machine learning, pytorch, sql",3.19,Diploma,4.0,2.0,4.0,3.0,1.0,adbksw.ywzsq@gmail.com,,,,2.8500000000000005,0.4061459237116564,1,1
,Ktdnxojb Bboie,,,"docker, python",2.76,B.Tech,2.0,3.0,4.0,5.0,5.0,ktdnxojb.bboie@gmail.com,,,,2.45,0.14320114822216484,1,1
,Vygyq Eyxej,,,"data analysis, javascript, python, sql",7.21,M.Sc,4.0,2.0,2.0,2.0,1.0,vygyq.eyxej@gmail.com,,,,2.25,2.8643738247994603,1,1
,Xhewci Vjvfm,,,"c++, css, deep learning, node.js, python",3.14,B.E,3.0,4.0,3.0,1.0,1.0,xhewci.vjvfm@gmail.com,,,,2.6,0.3755709498175296,1,1
,Wgnqdyw Qgggbw,,,"machine learning, pytorch, python",0.86,M.Tech,2.0,4.0,5.0,4.0,2.0,wgnqdyw.qgggbw@gmail.com,,,,3.2,-1.0186478597546578,1,1
,Ydopmp Iukvz,,,"aws, data analysis, java, machine learning, pytorch, react",0.6,BCA,4.0,3.0,3.0,2.0,5.0,ydopmp.iukvz@gmail.com,,,,2.15,-1.1776377240041176,0,0
,Zlzymwum Iavtaz,,,"html, javascript, machine learning, pytorch, sql",2.18,B.Tech,1.0,3.0,1.0,3.0,5.0,zlzymwum.iavtaz@gmail.com,,,,1.2,-0.21146854894970715,1,1
,Shypmeh Bydhzsmn,,,"aws, data analysis, html, javascript, kubernetes, pytorch",3.54,MCA,5.0,3.0,2.0,2.0,5.0,shypmeh.bydhzsmn@gmail.com,,,,2.1999999999999997,0.6201707409705448,0,0
,Tjrhywh Lonbfdjh,,,"aws, css, docker, java, machine learning, node.js",0.15,M.Sc,1.0,1.0,1.0,2.0,5.0,tjrhywh.lonbfdjh@gmail.com,,,,0.3999999999999999,-1.45281248905126,0,0
,Shgkasb Sdvlar,,,"c++, deep learning, docker, kubernetes, python, react, tensorflow",2.14,M.Tech,1.0,3.0,3.0,4.0,5.0,shgkasb.sdvlar@gmail.com,,,,1.7999999999999998,-0.2359285280650087,1,1
,Njvag Vcbwjjo,,,"aws, css, deep learning, html, python, react, sql",1.54,B.Sc,2.0,4.0,2.0,3.0,2.0,njvag.vcbwjjo@gmail.com,,,,2.4000000000000004,-0.6028282147945317,0,0
,Xvhvxtr Ufuttdq,,,"c++, deep learning, javascript, kubernetes, react, tensorflow",0.09,M.Tech,2.0,2.0,5.0,5.0,5.0,xvhvxtr.ufuttdq@gmail.com,,,,2.35,-1.4895024577242124,0,0
,Ayvxh Gvhua,,,"html, react",3.72,M.Sc,2.0,5.0,2.0,1.0,5.0,ayvxh.gvhua@gmail.com,,,,1.85,0.7302406469894018,0,0
,Cvqtwlxk Coyhqzab,,,"javascript, python, tensorflow",0.79,B.Tech,4.0,5.0,2.0,4.0,5.0,cvqtwlxk.coyhqzab@gmail.com,,,,2.95,-1.0614528232064355,1,1
,Qgvcp Ldxxtph,,,"deep learning, java, machine learning, python, react",0.61,B.Sc,2.0,3.0,3.0,1.0,1.0,qgvcp.ldxxtph@gmail.com,,,,2.0500000000000003,-1.1715227292252923,1,1
,Lpwxctkg Gejjp,,,"aws, kubernetes, machine learning, node.js, sql, tensorflow",0.76,Diploma,5.0,3.0,4.0,4.0,2.0,lpwxctkg.gejjp@gmail.com,,,,3.45,-1.0797978075429115,1,1
,Kggebs Dhzhgljd,,,"aws, pytorch, python, react",1.74,BCA,2.0,2.0,1.0,2.0,4.0,kggebs.dhzhgljd@gmail.com,,,,1.1,-0.4805283192180241,0,0
,Srrqhkd Zvnzteo,,,"docker, html",2.27,B.Tech,4.0,3.0,5.0,5.0,3.0,srrqhkd.zvnzteo@gmail.com,,,,3.45,-0.15643359594027878,1,1
,Yuqvb Lqoziupb,,,"docker, javascript",0.49,B.Tech,5.0,2.0,4.0,5.0,5.0,yuqvb.lqoziupb@gmail.com,,,,2.9000000000000004,-1.2449026665711969,0,0
,Dfdzfll Gltemt,,,"css, docker, python, sql",0.66,B.Sc,4.0,5.0,5.0,2.0,2.0,dfdzfll.gltemt@gmail.com,,,,3.6,-1.1409477553311653,1,1
,Vtrmvuh Edsgnx,,,"data analysis, java, python",1.42,M.Sc,1.0,5.0,2.0,5.0,5.0,vtrmvuh.edsgnx@gmail.com,,,,2.4,-0.6762081521404364,0,0
,Xeqscfek Uaqfmkj,,,"deep learning, docker, javascript, react, sql",1.69,B.Tech,2.0,5.0,3.0,3.0,3.0,xeqscfek.uaqfmkj@gmail.com,,,,2.75,-0.5111032931121511,0,0
,Ttptvmma Oilinh,,,"javascript, machine learning",0.47,Diploma,5.0,2.0,3.0,5.0,5.0,ttptvmma.oilinh@gmail.com,,,,2.7,-1.2571326561288478,1,1
,Nmkyw Rwuklu,,,"deep learning, docker, java, pytorch, python, sql",4.84,M.Tech,2.0,2.0,2.0,4.0,1.0,nmkyw.rwuklu@gmail.com,,,,2.15,1.4151200622178446,1,1
,Urzlcx Pxlwe,,,"aws, c++, deep learning, docker, python",0.6,Diploma,5.0,1.0,4.0,5.0,4.0,urzlcx.pxlwe@gmail.com,,,,2.75,-1.1776377240041176,1,1
,Uqrngyfv Idrolsf,,,"css, docker, kubernetes, machine learning, node.js, python",0.8,M.Tech,1.0,3.0,1.0,4.0,4.0,uqrngyfv.idrolsf@gmail.com,,,,1.5499999999999998,-1.05533782842761,1,1
,Easeq Mvcbb,,,"deep learning, kubernetes, python",3.13,B.Tech,1.0,1.0,2.0,3.0,5.0,easeq.mvcbb@gmail.com,,,,0.8000000000000003,0.3694559550387041,1,1
,Jzqzh Wvpaag,,,"deep learning, machine learning, node.js, pytorch, python, sql",4.37,Diploma,2.0,2.0,3.0,5.0,5.0,jzqzh.wvpaag@gmail.com,,,,1.9500000000000002,1.1277153076130517,1,1
,Xmbeb Jfghx,,,"javascript, node.js, pytorch, tensorflow",7.39,B.Tech,1.0,1.0,3.0,3.0,3.0,xmbeb.jfghx@gmail.com,,,,1.3000000000000003,2.974443730818317,0,0
,Muufhle Zifhosrt,,,"aws, data analysis, docker, machine learning, pytorch",3.92,BCA,5.0,1.0,1.0,5.0,2.0,muufhle.zifhosrt@gmail.com,,,,2.45,0.8525405425659094,1,1
,Cifpnlv Nygfj,,,"javascript, python",2.69,MCA,2.0,2.0,3.0,4.0,2.0,cifpnlv.nygfj@gmail.com,,,,2.2,0.10039618477038725,1,1
,Rdhugge Yudprvy,,,"aws, docker, machine learning",0.32,B.Sc,1.0,1.0,3.0,2.0,2.0,rdhugge.yudprvy@gmail.com,,,,1.2500000000000002,-1.3488575778112286,0,0
,Folphikr Ruyebmdi,,,"docker, html, kubernetes, node.js, python, react, tensorflow",0.25,Diploma,1.0,5.0,4.0,4.0,3.0,folphikr.ruyebmdi@gmail.com,,,,2.8999999999999995,-1.3916625412630061,1,1
,Sjypgjze Dzbsugcx,,,"aws, c++, machine learning, pytorch",0.3,B.Sc,2.0,2.0,5.0,2.0,3.0,sjypgjze.dzbsugcx@gmail.com,,,,2.05,-1.3610875673688794,0,0
,Rqurusl Eeoabtb,,,"css, docker, java, node.js, python, react",0.74,MCA,2.0,3.0,1.0,1.0,2.0,rqurusl.eeoabtb@gmail.com,,,,1.4999999999999998,-1.0920277971005623,0,0
,Hayeu Ryafs,,,"node.js, sql",2.3,B.E,3.0,3.0,1.0,2.0,4.0,hayeu.ryafs@gmail.com,,,,1.65,-0.13808861160380276,0,0
,Woscdidi Afghv,,,"c++, html, machine learning",0.17,B.E,2.0,1.0,2.0,2.0,3.0,woscdidi.afghv@gmail.com,,,,1.1500000000000001,-1.4405824994936092,0,0
,Equlsk Cpuur,,,"data analysis, java, machine learning, python, react",0.45,B.Tech,5.0,2.0,5.0,3.0,2.0,equlsk.cpuur@gmail.com,,,,3.1500000000000004,-1.2693626456864984,1,1
,Uwyetago Brlrqiwd,,,"docker, machine learning, python, sql",2.66,Diploma,1.0,3.0,5.0,5.0,1.0,uwyetago.brlrqiwd@gmail.com,,,,3.0,0.08205120043391123,1,1
,Wokfmods Pvfjzz,,,"c++, css, html, kubernetes, machine learning, react",3.14,Diploma,5.0,1.0,3.0,4.0,5.0,wokfmods.pvfjzz@gmail.com,,,,2.2,0.3755709498175296,1,1
,Nxpwb Dauvkv,,,"deep learning, html, machine learning, pytorch, python",2.1,M.Sc,1.0,2.0,2.0,3.0,1.0,nxpwb.dauvkv@gmail.com,,,,1.7000000000000002,-0.26038850718031026,1,1
,Sowkltg Btsxd,,,"html, javascript, node.js, pytorch, python",1.05,BCA,4.0,3.0,3.0,4.0,3.0,sowkltg.btsxd@gmail.com,,,,2.8499999999999996,-0.9024629589569755,1,1
,Cuusw Iosrvkal,,,"pytorch, python, react, tensorflow",5.23,BCA,1.0,1.0,1.0,5.0,1.0,cuusw.iosrvkal@gmail.com,,,,1.6,1.6536048585920349,1,1
